{
  "$schema": "https://json-schema.org/draft/2020-12",
  "$id": "lt1-test-report-v1",
  "title": "LT1 Step Test Report",
  "description": "Schema for LT1 aerobic threshold test report exported from Garmin watch app or parsed from FIT file.",
  "type": "object",
  "required": ["schema_version", "test_protocol_version", "athlete", "device", "lt1_result", "stages"],

  "properties": {

    "schema_version": {
      "type": "string",
      "description": "Report schema version for backward-compatible parsing.",
      "example": "1.0"
    },

    "test_protocol_version": {
      "type": "integer",
      "description": "Watch app protocol version (FIT session field 14).",
      "example": 1
    },

    "generated_at": {
      "type": "string",
      "format": "date-time",
      "description": "ISO-8601 timestamp when report was generated."
    },

    "athlete": {
      "type": "object",
      "description": "Athlete metadata from Garmin user profile.",
      "properties": {
        "name":       { "type": "string" },
        "age":        { "type": "integer" },
        "weight_kg":  { "type": "number" },
        "hr_max":     { "type": "integer", "description": "Max HR in bpm if known." },
        "vo2max_estimate": { "type": "number", "description": "Garmin VO2max estimate if available." }
      }
    },

    "device": {
      "type": "object",
      "description": "Recording device info.",
      "properties": {
        "model":       { "type": "string", "example": "Forerunner 955" },
        "part_number": { "type": "string" },
        "firmware":    { "type": "string" }
      }
    },

    "test": {
      "type": "object",
      "description": "Test session metadata.",
      "properties": {
        "date":              { "type": "string", "format": "date" },
        "start_time":        { "type": "string", "format": "date-time" },
        "duration_secs":     { "type": "integer" },
        "sport":             { "type": "string", "example": "running" },
        "environment":       { "type": "string", "example": "outdoor_road" }
      }
    },

    "hr_source": {
      "type": "object",
      "description": "Heart rate sensor characterization.",
      "properties": {
        "is_chest_strap": {
          "type": "boolean",
          "description": "True if ANT+ external HRM was detected providing real per-beat RR intervals."
        },
        "source_label": {
          "type": "string",
          "enum": ["chest_strap", "optical_wrist", "unknown"],
          "description": "Human-readable sensor classification."
        },
        "confidence": {
          "type": "number", "minimum": 0, "maximum": 1,
          "description": "Source classification confidence. Optical capped at 0.3."
        },
        "warnings": {
          "type": "array",
          "items": { "type": "string" },
          "description": "E.g. 'Optical HR detected — DFA alpha1 reliability reduced'."
        }
      }
    },

    "lt1_result": {
      "type": "object",
      "description": "Final LT1 (aerobic threshold) estimate.",
      "required": ["detected"],
      "properties": {
        "detected": {
          "type": "boolean",
          "description": "Whether LT1 was successfully estimated."
        },
        "lt1_hr_bpm": {
          "type": "number",
          "description": "Estimated LT1 heart rate in beats per minute. 0 if not detected."
        },
        "lt1_pace_sm": {
          "type": "number",
          "description": "Estimated LT1 pace in seconds per meter. 0 if pace unavailable."
        },
        "lt1_pace_min_km": {
          "type": "string",
          "description": "LT1 pace formatted as min:sec per km (derived from lt1_pace_sm). E.g. '5:23'."
        },
        "lt1_power_w": {
          "type": "number",
          "description": "Estimated LT1 running power in watts. 0 if power sensor unavailable."
        },
        "dfa_a1_at_detection": {
          "type": "number",
          "description": "DFA alpha1 value at the estimated LT1 crossing point (always ~0.75)."
        },
        "detection_stage": {
          "type": "integer",
          "description": "Stage number (1–6) where the LT1 crossing was bracketed. -1 if not detected."
        },
        "confidence_score": {
          "type": "number", "minimum": 0, "maximum": 1,
          "description": "Composite confidence [0,1]. Accounts for signal quality, slope, monotonicity, source."
        },
        "confidence_label": {
          "type": "string",
          "enum": ["High", "Medium", "Low", "Not detected"],
          "description": "Human-readable confidence label."
        },
        "signal_quality_overall": {
          "type": "number", "minimum": 0, "maximum": 1,
          "description": "Mean RR quality score across the entire test."
        },
        "warnings": {
          "type": "array",
          "items": { "type": "string" },
          "description": "Non-fatal issues found during detection (non-monotone alpha1, low quality, etc.)."
        }
      }
    },

    "stages": {
      "type": "array",
      "description": "Per-stage summary data. Length = number of completed stages (max 6).",
      "items": {
        "type": "object",
        "required": ["stage_number", "mean_dfa_a1"],
        "properties": {
          "stage_number":   { "type": "integer", "minimum": 1, "maximum": 6 },
          "mean_hr_bpm":    { "type": "number", "description": "Mean HR over analysis window." },
          "mean_pace_sm":   { "type": "number", "description": "Mean pace (s/m) over analysis window." },
          "mean_pace_min_km": { "type": "string" },
          "mean_power_w":   { "type": "number" },
          "mean_dfa_a1":    { "type": "number", "description": "Mean DFA alpha1 over valid windows." },
          "validity_score": { "type": "number", "minimum": 0, "maximum": 1,
                              "description": "Fraction of 30-s windows that were valid." },
          "rr_quality":     { "type": "number", "minimum": 0, "maximum": 1 },
          "window_count":   { "type": "integer", "description": "Total 30-s DFA windows in this stage." }
        }
      }
    },

    "timeseries": {
      "type": "object",
      "description": "Time-series arrays for plotting. Sampled every 30 s (DFA update interval). Sourced from FIT records with developer field data.",
      "properties": {
        "timestamps_s": {
          "type": "array",
          "items": { "type": "integer" },
          "description": "Seconds since test start for each sample."
        },
        "dfa_a1": {
          "type": "array",
          "items": { "type": "number" },
          "description": "DFA alpha1 at each sample. -1.0 = not computed."
        },
        "heart_rate_bpm": {
          "type": "array",
          "items": { "type": "number" }
        },
        "pace_sm": {
          "type": "array",
          "items": { "type": "number" },
          "description": "Pace in s/m. 0 = no GPS."
        },
        "power_w": {
          "type": "array",
          "items": { "type": "number" },
          "description": "Running power in watts. 0 = no power sensor."
        },
        "rr_quality": {
          "type": "array",
          "items": { "type": "number" },
          "description": "RR quality score [0,1] at each sample."
        },
        "stage": {
          "type": "array",
          "items": { "type": "integer" },
          "description": "Current stage (0=warmup, 1–6=stage) at each sample."
        },
        "valid_window": {
          "type": "array",
          "items": { "type": "boolean" },
          "description": "Whether this sample was in the valid analysis window."
        }
      }
    }
  }
}
